{
  "schema_version": "program-007-unit-changing-action-ledger-v1",
  "ledger_id": "program-007-public-unit-changing-action-ledger-2026-08-28-v1",
  "program_id": "multi-hour-sector-etf-research-006",
  "status": "PUBLIC-EVIDENCE-COMPLETE-NON-AUTHORIZING",
  "schema_binding": {
    "path": "config/research/program-007-unit-changing-action-ledger-v1.schema.json",
    "sha256": "183b3b0a103839efb177924ca80cab73b7335ebe582e4a17a7ba5450a40270e8"
  },
  "chronology": {
    "start_session": "2020-06-26",
    "end_session": "2026-07-31",
    "prehistory_rule": "Coverage begins twenty XNYS sessions before the 2020-07-27 feature chronology so every prior-20-session same-clock relative-volume input is covered. No conclusion extends beyond the frozen dates."
  },
  "normalization": {
    "basis": "The basis is the share unit in use on the session whose relative-volume feature is being computed.",
    "factor_representation": "exact Fraction new_shares/old_shares",
    "effective_boundary": "For an action effective before the market open, every bar on the effective session is already in post-action units. The preceding XNYS session remains in pre-action units.",
    "prior_volume_rule": "Multiply each prior-session same-clock share count by every exact new_shares/old_shares ratio whose effective session is after the source session and on or before the basis session.",
    "same_session_price_rule": "Retain raw contemporaneous prices for fills, marks, and same-session calculations. Do not create a provider-adjusted or repository-adjusted historical price view.",
    "same_session_return_proof": "Within one session the split factor f is constant, so (f*p1)/(f*p0)-1 equals p1/p0-1.",
    "raw_dollar_volume_proof": "For split ratio r, post-unit price times post-unit volume is (p/r)*(v*r)=p*v, so raw contemporaneous dollar volume is unit invariant.",
    "reverse_split_rule": "Use the same new_shares/old_shares orientation. A 1-for-5 reverse split maps a pre-action share count to the post-action basis by multiplying by 1/5.",
    "multiple_action_rule": "Multiply exact ratios in effective-session order. Crossing the same actions in reverse divides by the same cumulative factor."
  },
  "non_transformable_policy": {
    "scope": "Any ambiguous action, identity break, spin-off, reorganization, or other event whose share-unit mapping is not established by authoritative evidence.",
    "action": "FAIL-DATASET-ADMISSION-BEFORE-STRATEGY",
    "missingness_budget_can_override": false,
    "reason": "Program 007 does not invent reciprocal volume or price semantics for non-split actions. A new reviewed ledger version is required before affected feature windows may be admitted."
  },
  "symbols": [
    {
      "symbol": "IWM",
      "fund_identity": "iShares Russell 2000 ETF",
      "coverage_start": "2020-06-26",
      "coverage_end": "2026-07-31",
      "conclusion": "NO-APPLICABLE-ACTION-FOUND",
      "action_ids": [],
      "evidence_ids": [
        "ishares-iwm-current-fund-page",
        "sec-ishares-2021-registration",
        "sec-ishares-2026-ncsr",
        "nyse-corporate-action-notice-policy",
        "cftc-iwm-2005-split-record"
      ],
      "continuity_notes": "The issuer and SEC records preserve the same IWM fund identity across the frozen chronology. The documented 2005 split predates the ledger start. No later applicable action was found; this is a bounded chronology conclusion, not a whole-life absence claim."
    },
    {
      "symbol": "MDY",
      "fund_identity": "State Street SPDR S&P MidCap 400 ETF Trust",
      "coverage_start": "2020-06-26",
      "coverage_end": "2026-07-31",
      "conclusion": "NO-APPLICABLE-ACTION-FOUND",
      "action_ids": [],
      "evidence_ids": [
        "sec-mdy-2020-annual",
        "sec-mdy-2026-registration",
        "nyse-corporate-action-notice-policy"
      ],
      "continuity_notes": "Audited 2020 records, the current 2026 registration, and NYSE Arca notice requirements support continuous MDY unit identity over the frozen chronology. No applicable unit-changing action was found."
    },
    {
      "symbol": "SPY",
      "fund_identity": "State Street SPDR S&P 500 ETF Trust",
      "coverage_start": "2020-06-26",
      "coverage_end": "2026-07-31",
      "conclusion": "NO-APPLICABLE-ACTION-FOUND",
      "action_ids": [],
      "evidence_ids": [
        "sec-spy-2020-annual",
        "sec-spy-2025-annual",
        "sec-spy-2026-registration",
        "nyse-corporate-action-notice-policy"
      ],
      "continuity_notes": "Audited 2020 and 2025 financial records, the current 2026 registration, and NYSE Arca notice requirements support continuous SPY unit identity. No applicable unit-changing action was found."
    },
    {
      "symbol": "XLB",
      "fund_identity": "State Street Materials Select Sector SPDR ETF",
      "coverage_start": "2020-06-26",
      "coverage_end": "2026-07-31",
      "conclusion": "APPLICABLE-ACTIONS-RECORDED",
      "action_ids": ["sector-spdr-XLB-2025-12-05-2-for-1"],
      "evidence_ids": [
        "state-street-2025-sector-split-notice",
        "miax-2025-sector-split-alert",
        "sec-sector-2026-semiannual-note-13",
        "sec-sector-2020-semiannual",
        "sec-sector-2025-annual",
        "sec-sector-2026-registration"
      ],
      "continuity_notes": "The bounded chronology contains the recorded 2-for-1 split effective for trading on 2025-12-05 and no other applicable unit-changing action."
    },
    {
      "symbol": "XLE",
      "fund_identity": "State Street Energy Select Sector SPDR ETF",
      "coverage_start": "2020-06-26",
      "coverage_end": "2026-07-31",
      "conclusion": "APPLICABLE-ACTIONS-RECORDED",
      "action_ids": ["sector-spdr-XLE-2025-12-05-2-for-1"],
      "evidence_ids": [
        "state-street-2025-sector-split-notice",
        "miax-2025-sector-split-alert",
        "sec-sector-2026-semiannual-note-13",
        "sec-sector-2020-semiannual",
        "sec-sector-2025-annual",
        "sec-sector-2026-registration"
      ],
      "continuity_notes": "The bounded chronology contains the recorded 2-for-1 split effective for trading on 2025-12-05 and no other applicable unit-changing action."
    },
    {
      "symbol": "XLF",
      "fund_identity": "State Street Financial Select Sector SPDR ETF",
      "coverage_start": "2020-06-26",
      "coverage_end": "2026-07-31",
      "conclusion": "NO-APPLICABLE-ACTION-FOUND",
      "action_ids": [],
      "evidence_ids": [
        "sec-sector-2020-semiannual",
        "sec-sector-2025-annual",
        "sec-sector-2026-registration",
        "sec-xlf-xlre-2016-distribution",
        "nyse-corporate-action-notice-policy"
      ],
      "continuity_notes": "The 2016 XLRE distribution predates the frozen chronology and did not change XLF unit count. No applicable unit-changing action was found from 2020-06-26 through 2026-07-31."
    },
    {
      "symbol": "XLI",
      "fund_identity": "State Street Industrial Select Sector SPDR ETF",
      "coverage_start": "2020-06-26",
      "coverage_end": "2026-07-31",
      "conclusion": "NO-APPLICABLE-ACTION-FOUND",
      "action_ids": [],
      "evidence_ids": [
        "sec-sector-2020-semiannual",
        "state-street-2025-sector-split-notice",
        "sec-sector-2025-annual",
        "sec-sector-2026-registration",
        "nyse-corporate-action-notice-policy"
      ],
      "continuity_notes": "XLI is absent from the issuer's exhaustive five-fund 2025 split notice and retains continuous identity in SEC records. No applicable unit-changing action was found over the bounded chronology."
    },
    {
      "symbol": "XLK",
      "fund_identity": "State Street Technology Select Sector SPDR ETF",
      "coverage_start": "2020-06-26",
      "coverage_end": "2026-07-31",
      "conclusion": "APPLICABLE-ACTIONS-RECORDED",
      "action_ids": ["sector-spdr-XLK-2025-12-05-2-for-1"],
      "evidence_ids": [
        "state-street-2025-sector-split-notice",
        "miax-2025-sector-split-alert",
        "sec-sector-2026-semiannual-note-13",
        "sec-sector-2020-semiannual",
        "sec-sector-2025-annual",
        "sec-sector-2026-registration"
      ],
      "continuity_notes": "The bounded chronology contains the recorded 2-for-1 split effective for trading on 2025-12-05 and no other applicable unit-changing action."
    },
    {
      "symbol": "XLP",
      "fund_identity": "State Street Consumer Staples Select Sector SPDR ETF",
      "coverage_start": "2020-06-26",
      "coverage_end": "2026-07-31",
      "conclusion": "NO-APPLICABLE-ACTION-FOUND",
      "action_ids": [],
      "evidence_ids": [
        "sec-sector-2020-semiannual",
        "state-street-2025-sector-split-notice",
        "sec-sector-2025-annual",
        "sec-sector-2026-registration",
        "nyse-corporate-action-notice-policy"
      ],
      "continuity_notes": "XLP is absent from the issuer's exhaustive five-fund 2025 split notice and retains continuous identity in SEC records. No applicable unit-changing action was found over the bounded chronology."
    },
    {
      "symbol": "XLRE",
      "fund_identity": "State Street Real Estate Select Sector SPDR ETF",
      "coverage_start": "2020-06-26",
      "coverage_end": "2026-07-31",
      "conclusion": "NO-APPLICABLE-ACTION-FOUND",
      "action_ids": [],
      "evidence_ids": [
        "sec-sector-2020-semiannual",
        "state-street-2025-sector-split-notice",
        "sec-sector-2025-annual",
        "sec-sector-2026-registration",
        "sec-xlf-xlre-2016-distribution",
        "nyse-corporate-action-notice-policy"
      ],
      "continuity_notes": "The 2016 creation/distribution context predates the chronology. XLRE is absent from the issuer's 2025 split notice and retains continuous identity in SEC records. No applicable unit-changing action was found."
    },
    {
      "symbol": "XLU",
      "fund_identity": "State Street Utilities Select Sector SPDR ETF",